ID	Narrative	CrossRef	Index
note96	"The offending phrase in the special preface in the communion service for Whitsuntide was 'the gift of divers languages', described as bestowed upon the Apostles by the Holy Ghost. In his sermon, Henson objected to the literal and what he regarded as an impossible interpretation of the phrase, arguing instead for a metaphorical and true meaning of the ability of the universal Church to bring the Gospel to all human beings, regardless of 'race, creed, habit, class, temperament': 'Ecclesiastical intelligence', <i>Times</i>, 20 May 1907, 8. The revised prayer book of 1927-8 offered a second, alternative, communion service, in which the phrase was replaced.     "	""  
note97	"The general assembly of the Church of Scotland, as the national church, is attended by a personal representative of the sovereign, the Lord High Commissioner. During the first session, the clerk reads out the Commissioner's warrant of appointment from the sovereign ('commission'), and the Commissioner then makes a short address. The Commissioner did not participate in the assembly proceedings, and the role had become largely ceremonial and symbolic."	""  
note98	"The 'allusions' probably related to the refusal of Anglican bishops in India to make their churches available to Scottish regiments, while presbysterian churches were being constructed for them. It was reported to the meeting of the general assembly of the Church of Scotland attended by Henson that an agreement had been reached with the secretary of state to arrange suitable church accommodation: 'Ecclesiastical intelligence', <i>Times</i>, 23 May 1907, 4."	""  
note99	"The committee on aids to devotion was a standing committee of the general assembly of the Church of Scotland. Its responsibilities included publications to assist private prayers and public worship."	""  
note100	"A number of parliamentary measures and the House of Lords decision of 1904 in the case of the Free Church's property dispute with the United Free Church had raised questions about the precise legal definitions of the subscription required by ministers and professors of theology to the Church's confession of faith, under legislation dating from the 1690s. The general assembly's new 'formula of subscription' was designed to accommodate subsequent theological changes, and reduce the possibility of unwelcome parliamentary intervention."	""  
note102	"Henson acquired Stanley's Dresden clock through a bequest from Robinson Duckworth, and his writing table on the death of his successor, Dean Bradley; he described them as 'among my most treasured possessions': <i>Retrospect</i>, I, 52."	""  
note104	"The ceremony marked the beginning of the legal year. It was attended by judges who were members of the Church of EnglandÊand the various free churches; Roman catholic judges attended a service in Westminister Cathedral: 'Law Report', <i>Times</i>, 13 Oct. 1908, 3."	""  
note105	"Mabie, Todd & Co. produced silver 'Swan' fountain pens in Britain around 1909; with their ornate decoration, they were considered among the finest of their day. They were advertised outside of the USA as 'the pen of the British Empire'. "	""  
note106	"As leader of the Unionist opposition in the House of Lords, Lansdowne moved the rejection of Lloyd George's budget."	""  
note107	"The rector of St Margaret's was paid an annual rent of poundsign7 by the dean and chapter in lieu of the 'Anchorite's house' adjoining the church, where his curate had lived before its demolition in 1778. From Henson's accounts, it seems that the rector also received poundsign17 per annum as compensation from the construction of St John the Evangelist, Smith Square, in 1728: H. F. Westlake, <i>St. Margaret's Westminster: the Church of the House of Commons</i> (1914), 21, 70-1."	""  
note109	"Against the threat of the Liberal government to create five hundred new peers, the House of Lords voted narrowly to accept the Parliament bill, which abolished the Lords' veto on financial bills and replaced its veto over other bills to a power of delay for a maximum of two years. With the Unionist majority in the house divided, the votes of the archbishops and bishops were decisive."	""  
note110	"An increasing number of London transport workers had come out on strike in recent days, causing shortages of food. The London docks were reported to be at a standstill, and deliveries of food to metropolitan markets such as Smithfield badly disrupted: 'The restricted food supply', <i>Times</i>, 11 Aug. 1911, 8."	""  
note112	"The Royal Commission on divorce and matrimonial causes was appointed in November 1909 and reported in 1912. Chaired by Lord Gorell, its members included Archbishop Lang. Henson was not asked to provide evidence."	""  
note113	"A reference to the over hundred Covenanters who were hanged in the Grassmarket from 1661 to 1688 for their resistance to the government's efforts to impose episcopacy on the Church of Scotland. A memorial was created in 1937."	""  
note114	"John Knox House in the High Street is associated with Knox although he appears to have lived in Warriston Close nearby. Lord Guthrie was the author of <i>John Knox and John Knox's House</i> (1905)."	""  
note115	"Edinburgh University Settlement had been established in 1905 in High School Yards; its founding convenor was Sir Richard Lodge."	""  
note116	"Halifax had alleged that during the recent controversay over state aid for schools, Henson had proposed placing Roman catholic schools in a more favourable position than Church of England schools. He described Henson as a 'kind of ecclesiastical Puck whose utterances attracted notice, indeed because he was clever; but notice was not respect, and it was doubtful many members of the Church of England entertained such opinions. (Hear, hear)': 'Ecclesiastical intelligence', <i>Times</i>, 18 Feb. 1910, 4."	""  
note117	"Letter, 'Lord Halifax and Canon Henson', <i>Times</i>, 19 Feb. 1910, 4. This contained a short extract from Henson's letter to the editor of The Guardian three weeks earlier, denouncingÊRoman catholic schools as denominational, in contrast to the national status of Church of England schools."	""  
note118	"The sermon rejected the charge that Pilate was a tyrant, arguing that he was portrayed in the gospels as an upholder of truth and justice, but acquiesced to popular demands for Christ's death. Pilate, he argued, 'shrank from the risks of doing right', a lesson that politicians - both ecclesiastical and civil - could not afford to ignore, especially in the present: 'Good Friday Sermons', <i>Times</i>, 26 Mar. 1910, 4. Summarising the sermon on an earlier page, the newspaper referred to Henson's 'pointed allusion to the present circumstances of the nation' ('Home Affairs', 7), meaning the incipient constitutional crisis."	""  
note119	"Scattered limbs (Ovid, <i>Met.</i>, III, 724); disjecta membra poetae, limbs of the dismembered poet: Horace, <i>Sat.</i>, I. iv. 62."	""  
note120	"29 May, the anniversary of Charles II's arrival in London in 1660 after the interregnum, had until 1859 been celebrated in church and state as 'Restoration day'. The Restoration religious settlement resulted during 1662 in perhaps 2,500 ministers leaving the Church rather than accept the Act of Uniformity and subscription to the BCP - the origin of protestant 'nonconformity'. Henson's allusion to a new Oxford movement expressed a hope that anglo-catholics, heirs of the original Oxford Movement, would be prevented from creating similar damage, by dividing the Church and obstructing reunion among the protestant churches. "	""  
note122	"By the Bill of Rights in 1689, sovereigns were requiredÊafter their accession to read out a 'declaration against transubstantiation'. SinceÊ1901, whenÊEdward VII read itÊwith obvious reluctance, several efforts were made to revise the text,Êgiven its obvious offence to Roman catholics and the general acceptance of religious toleration, but these faced resistance from the moreÊardentÊprotestants in the Church of England and the free churches.ÊIn 1910,ÊGeorge V's refusal toÊread the original text obliged the Liberal cabinet to make another attempt, andÊafter some difficulty but with assistanceÊfrom Archbishop Davidson, it obtainedÊthe Accession Declaration Act, replacing the anti-catholic formula with a positive commitment to uphold protestantism: Bell, <i>Davidson</i>, 612-18."	""  
note124	"The hill country of south-west Scotland had been the heartland of the strict presbyterian Covenantors, who from 1660 to 1688 suffered persecution for their resistance to episcopacy and erastianism imposed by the royal government. Many were executed or killed in skirmishes, in what was later immortalised as 'the Killing Time'."	""  
note125	"<i>Vice-Versa: A Lesson to Fathers</i>, based on the novel of that name by 'F. Anstey' [Thomas Anstey Guthrie], published in 1882, which centred on a body swap between father and son. It was adaptedÊfor the stageÊby Edward Rose in 1883."	""  
note126	"For a dramatic account of the Sidney Street siege, attended by Winston Churchill as home secretary, see 'Fight with anarchists', <i>Times</i>, 4 Jan. 1911, 8."	""  
note129	"The Victoria Memorial at the end of the Mall, opposite Buckingham Palace,Êhad been unveiled on 16 May 1911."	""  
note130	"A national strike on the railways had begun on 18 August 1911. It was called off following Lloyd George's intervention on 19 August, although a further strike of all transport workers in Liverpool subsequently spread to waterside workers in other ports."	""  
note131	"The Synod of Dort [Dordrecht] (1618-19), an international gathering of Calvinists,Êresulted in the rejection ofÊArminianism. Joseph Hall, later bishop of Exeter and Norwich, was a leading English opponent of Arminius's rejection of predestination."	""  
note132	"Henson to Violet Markham, 8 Sep. 1911, Markham Papers, 25/41. Henson expressed disdain towards not just the railway strikes but alsoÊrecent elevations of anglo-catholics inÊthe Church, and suggested a link between the two: 'This little rush of new Appointments is strengthening the Interest against which I contend. Gore is preferred to Oxford, as if to assure the world that a Liberal Government finds its natural Ally in aggressive Sacerdotalism: & if Liberalism be, as some say & many fear, only now a synonym for Socialism, then the assurance is well-grounded. The enemy of both Socialism & Sacerdotalism is the same Ð the Right of the individual to be himself, to exercise his private judgment, & to learn his Duty in the last resort from the spirit within, & not from the bullying Dictatorships without.'"	""  
note137	"The Bunyan memorial window in the west aisle of the north transept of Westminster Abbey, designed by J. Ninian Comper,Êwas unveiled on 25 January 1912. Funds for the window were raised by public subscription. "	""  
note141	"Before the Re-election of Ministers (Abolition) Act of 1919 (for nine months after an election) and an Amendment Act in 1926 (which abolished the practice altogether), MPs appointed to certain government posts were required to resign their seats and seek re-election. Sir Arthur Haworth had fought a by-election in his South Manchester constituency when appointed junior lord of the treasury; he lost to the Unionist candidate, P. K. Glazebrook by 579 votes, on a 24% swing."	""  
note142	"The cartoon appeared in the issue of April 1912 and is included in <i>Retrospect</i>, I, 33 (facing page)."	""  
note144	"The Miners Federation of Great Britain had stopped work in support of a minimum wage-rate of 5s a shift for men and 2s for boys. The strike lasted for five weeks before the government hastily passedÊthrough parliament a Miners' Minimum Wage Act. Although unsatisfactory to the miners, the union called off the strike."	""  
note145	"White slavery' became the focus of a pre-war campaign against the involvement of 'foreigners' in abetting female prostitution. It was spearheaded by the editor W. T. Stead. Following his death on the Titanic, Parliament honoured his memory by passing the Criminal Law Amendment (White Slavery) Act in 1912. One clause empowered the courts to sentence men with a second conviction to flogging; another clause authorised the arrest of those suspected of procuring prostitutes."	""  
note154	"Letters exchanged between Cariss, Henson and Gore were published in newspapers, and then collected in a privately printed pamphlet: see <i>Correspondence</i> in Davidson papers, 155/351-60, and <i>Retrospect</i>, I, 92-6. Cariss as the Anglican minister and Gore as bishop had claims to approve a preacher in their parish and diocese; they had still greater cause for complaint when an Anglican clergyman preached in a free church chapel. Henson framed and hung Gore's Inhibition on his study wall, where it remained until at least 1932: Braley, <i>Letters</i>, 67."	""  
note168	"'Holy Mary, Virgin and Mother of Jesus Christ, work with Your Sons that this daily lecture may advance in that way, so that all boys may learn of Him in the same way, so that they may be educated in this way, so that at last they may become perfect sons of God through Him, and You also, most generous Jesus, work with your Father and our Father, so that the grace of His Spirit may make us His sons, to learn and imitate You Jesus in this age in such a way that we may reign together with you happily in the future.'"	""  
note170	"I strongly consider it unworthy that I should restrain the words of the heavenly Oracle under the rules of Donatus'"	""  
note171	"I am king of the Romans and above grammar'"	""  
note191	"Henson spoke of a 'general understanding' that the place of the Athanasian Creed within the Church's liturgy could no longer be maintained: 'Ecclesiastical intelligence', <i>Times</i>, 20 May 1907, 8. Attempts to remove the Creed centred on its 'damnatory clauses'; Henson argued for its entire removal in a sermon at St Margaret's in 1911: 'The public use of the Athanasian Creed', in <i>The Creed in the Pulpit</i> (1911)."	""  
note192	"Traditionally, ministers in the Church of Scotland extemporised their church services; in 1857 the general assembly censured a minister for using a form of service. But from the 1860s a Church Service Society had promoted the use of set services, and from the 1880s they became more acceptable. The use of a set service for the general assembly was notable; not until 1914 did it authorise printed services for general use."	""  
note193	"Henson later wrote of his preference for the Anglican administration of the sacraments, although he did not think that the different rite in the Scottish Church should be a barrier to spiritual fellowship: <i>Retrospect</i>, I, 68. In recent decades, the liturgical and ecumencial movements have ensured that sacramental practice is moving more towards the Scottish model, blurring the boundary between the sacred and the social. "	""  
